{
  "schema_version": "1.0",
  "status": "planned",
  "created_at": "2026-05-26T00:30:00Z",
  "base_url": "http://127.0.0.1:18093",
  "local_proxy_listen": "127.0.0.1:18096",
  "protected_app_map": "protected_app_map_lab.json",
  "connector_id": "conn_lab_001",
  "steering_host": "dummy-private-app.local",
  "request_url": "http://dummy-private-app.local/",
  "network_service": "Wi-Fi",
  "pac_file": "dsse_agent.pac",
  "pac_decision": "PROXY 127.0.0.1:18096",
  "pac_resolution_report": "pac_resolution.json",
  "macos_system_proxy_script": "apply_macos_system_proxy.sh",
  "macos_system_proxy_plan": "macos_system_proxy_plan.txt",
  "plan_only": true,
  "system_proxy_apply_requested": false,
  "system_proxy_applied": false,
  "steering_attempted": 0,
  "steering_succeeded": 0,
  "steering_failed": 0,
  "connect_unsupported": 0
}
